<?xml version="1.0" encoding="UTF-8"?>

<!-- inicio tiempo -->

<tiempo xmlns:xsi="http://www.w3.org/2001/XMLSchema-instance"
xsi:noNamespaceSchemaLocation="reglas.xsd">

<!--<comunidades autonomas>-->
    <comunidadAutonoma >
        <provincia>
            <poblacion>
            
            <prediccion>
              <fecha>2022/05/24</fecha>
              <tempMax>24.0</tempMax>
              <tempMin>9.0</tempMin>
              <probLluv>20.0</probLluv>
              <avisoRiesgo>viento</avisoRiesgo>
            </prediccion>

            <prediccion>
                <fecha>2022/05/23</fecha>
                <tempMax>21.0</tempMax>
                <tempMin>9.0</tempMin>
                <probLluv>45.0</probLluv>
                <avisoRiesgo>viento,lluvia</avisoRiesgo>
              </prediccion>
            </poblacion>
        </provincia>
    </comunidadAutonoma>
    

</tiempo> <!-- fin tiempo -->
